BEGIN test 25 of 36 with topology 80-400:.............28/12/2020 - 18:56:43
test command:	bash /home/mms/rootsim-models/start.sh -q -g -s --cat=/home/mms/test/catalog --top=/home/mms/test/topologies/80-400.txt use parallel --wt=20 --sched=FIFO --timeout=75 --lp_aggregation=lan --threads-less-than-lps --redir_compilation_messages=/dev/null --out=/home/mms/test/performance_tests/80-400/target_generation_simulation-seed_-1-timeout_75-use-parallel-threads_20-FIFO-preempt_no-sim_proc_no-lp_aggr_lan
results path: /home/mms/test/performance_tests/80-400/target_generation_simulation-seed_-1-timeout_75-use-parallel-threads_20-FIFO-preempt_no-sim_proc_no-lp_aggr_lan
Script started on 2020-12-28 18:56:43+01:00 [TERM="screen.xterm-256color" TTY="/dev/pts/1" COLUMNS="190" LINES="50"]
Starting generator...
Done.
Setting up folders for binary files...
Done.
Creating binary files...
Done.
Starting simulation...
Using USE as the simulation platform.
Removing previous output files..
Done.
Compiling model...
Done, executable is called "simulation_use" and can be found in the "/home/mms/test/performance_tests/80-400/target_generation_simulation-seed_-1-timeout_75-use-parallel-threads_20-FIFO-preempt_no-sim_proc_no-lp_aggr_lan" folder.
Executing model...
Parallel execution with 20 threads.
Script started, file is USE_output.txt
taken 4 parameters
commit hash: f92b47f3e71f40446daf297d46fa51563b69c0ac
***START SIMULATION***

[36m
Starting an execution with 20 THREADs, 881 LPs :
	- DYMELOR enabled.
	- CACHELINESIZE 64
	- CHECKPOINT PERIOD 10
	- EVTS/LP BEFORE CLEAN CKP 1000
	- ON_GVT PERIOD 4294967295
	- REPORT prints enabled.
	- THR_POOL_SIZE 1024
	- PREEMPT_COUNTER enabled.
	- LONG_JMP enabled.
	- HANDLE_INTERRUPT enabled.

[0mThread 1 set to CPU no 1
Thread 2 set to CPU no 2
Thread 3 set to CPU no 3
Thread 4 set to CPU no 4
Thread 5 set to CPU no 5
Thread 6 set to CPU no 6
Thread 7 set to CPU no 7
Thread 8 set to CPU no 8
Thread 9 set to CPU no 9
Thread 10 set to CPU no 10
Thread 11 set to CPU no 11
Thread 12 set to CPU no 12
Thread 13 set to CPU no 13
Thread 14 set to CPU no 14
Thread 15 set to CPU no 15
Thread 16 set to CPU no 16
Thread 17 set to CPU no 17
Thread 18 set to CPU no 18
Thread 19 set to CPU no 19
Thread 0 set to CPU no 0
LP_metada init finished
Dymelor_init finished
Statistics_init finished
Queue_init finished
master seed is 3247095341077619041
Numerical_init finished
Nodes_init finished
EXECUTED ALL INIT EVENTS
CALLING SLEEPING THREAD
The process will last 75 seconds
[32m[14] Execution ended correctly
[0m[32m[1] Execution ended correctly
[0m[32m[12] Execution ended correctly
[0m[32m[17] Execution ended correctly
[0m[32m[7] Execution ended correctly
[0m[32m[8] Execution ended correctly
[0m[32m[2] Execution ended correctly
[0m[32m[4] Execution ended correctly
[0m[32m[19] Execution ended correctly
[0m[32m[5] Execution ended correctly
[0m[32m[10] Execution ended correctly
[0m[32m[15] Execution ended correctly
[0m[32m[16] Execution ended correctly
[0m[32m[13] Execution ended correctly
[0m[32m[3] Execution ended correctly
[0m[32m[11] Execution ended correctly
[0m[32m[0] Execution ended correctly
[0m[32m[9] Execution ended correctly
[0m[32m[6] Execution ended correctly
[0m[32m[18] Execution ended correctly
[0mSimulation final report:
Thread: 20	LP: 881

===== SYSTEM-WIDE STATISTICS =====
[36mTotal events....................................:     16569483
Committed events................................:      3756218 (22.67%)
Events executed and committed tot...............:       154370
Straggler events................................:       658356 (3.97%)
Anti events.....................................:      1499047 (9.05%)
Useless events..................................:      3123706 (18.85%)
Silent events...................................:      9687968 (58.47%)
Silent events for GVT...........................:            0 (0.00%)

Flushed events..................................:      7558948 (45.62%)
Fetched operations..............................:      8380835 (50.58%)
   Fetch succeed................................:      8380594 (100.00%)
   Fetch failed.................................:          241 (0.00%)
   Avg node traversed during fetch..............:       705.46

Average time to process any event...............:      2804.88 clocks
   Average time spent in standard execution.....:      6578.98 clocks
   Average time spent in silent execution.......:       124.08 clocks (0.00%)
Average time spent to fetch.....................:    279998.08 clocks (0.00%)
   Average time in successfull fetch............:    278325.63 clocks (0.00%)
   Average time in unsuccessfull fetch..........:  58438237.68 clocks (0.00%)
Average time spent to Enqueue...................:     56660.32 clocks (0.00%)

Save Checkpoint operations.........................................:       685098
Restore Checkpoint operations......................................:      2157403
Rollback operations to resume LP state.............................:            0 (0.00%)
Rollback ops to resume LP state and re-execute evt interrupted.....:            0 (0.00%)
Rollback ops to resume LP state and execute evt in future..........:            0 (0.00%)
Rollback operations................................................:      2157403
AVG Rollbacked Events per Rollback.................................:         1.45
AVG Reprocessed Events per Rollback................................:         4.49
CheckOnGVT invocations.............................................:            0

Save Checkpoint time............................:    333539.38 clocks (334.58%)
Restore Checkpoint time.........................:     91281.28 clocks (91.57%)
Rollback time...................................:     99689.22 clocks
Checkpoint mem..................................:        92229 B
Checkpoint recalculations.......................:            0
Checkpoint period...............................:            0

Event not flushed tot...........................:            0
Exposition forward Time tot.....................: 480043837160 clocks
Exposition forward Time per event...............:     69758.45 clocks
Exposition silent Time tot......................:   8686283396 clocks
Exposition silent Time per event................:       896.61 clocks

Total resumable rollback executed...............:            0
Avg events resume per rollback_resume...........:         -nan
Avg clock resume per rollback resume............:         -nan clocks

Total allocated space...........................: 43605 MB


Total Clock.....................................: 3292425317880 clocks
Event Processing................................:  46475471444 clocks (1.41%)
Safe Processing.................................:  45273374778 clocks (1.38%)
Frame Processing................................:  24728360113 clocks (0.75%)
Rollback Processing.............................: 215069832620 clocks (6.53%)
Checkpoint Saving...............................: 228507163874 clocks (6.94%)
Fetch Successful................................: 2332534117634 clocks (70.85%)
[0m
Simulation ended (seconds):        76.99
Simulation ended  (clocks): 168977988164
Last gvt: 702526.100000
EventsPerSec:     48789.66
EventsPerThreadPerSec:      2439.48
[32mExecution ended correctly
[0mScript done, file is USE_output.txt
parsing statistics...
Done.
Exporting simulation statistics to simulation_stats.json...
Done.
Merging jsons in lp_data...
Done, results are in simulation_results.json.
Done.

Script done on 2020-12-28 18:58:04+01:00 [COMMAND_EXIT_CODE="0"]
Test 80-400 COMPLETE at 28/12/2020 - 18:58:04
