BEGIN test 99 of 168 with topology 80-400:.............26/12/2020 - 14:52:19
test command:	bash /home/mms/rootsim-models/start.sh -q -g -s --cat=/home/mms/test/catalog --top=/home/mms/test/topologies/80-400.txt use parallel --wt=10 --sched=FIFO --preempt --timeout=300 --lp_aggregation=regional --threads-less-than-lps --redir_compilation_messages=/dev/null --out=/home/mms/test/performance_tests/80-400/target_generation_simulation-seed_-1-timeout_300-use-parallel-threads_10-FIFO-preempt_yes-sim_proc_no-lp_aggr_regional
results path: /home/mms/test/performance_tests/80-400/target_generation_simulation-seed_-1-timeout_300-use-parallel-threads_10-FIFO-preempt_yes-sim_proc_no-lp_aggr_regional
Script started on 2020-12-26 14:52:19+01:00 [TERM="screen.xterm-256color" TTY="/dev/pts/2" COLUMNS="190" LINES="50"]
Starting generator...
Done.
Setting up folders for binary files...
Done.
Creating binary files...
creating LP.txt
Done.
Starting simulation...
Using USE as the simulation platform.
Removing previous output files..
Done.
Compiling model...
Done, executable is called "simulation_use" and can be found in the "/home/mms/test/performance_tests/80-400/target_generation_simulation-seed_-1-timeout_300-use-parallel-threads_10-FIFO-preempt_yes-sim_proc_no-lp_aggr_regional" folder.
Executing model...
Parallel execution with 10 threads.
Script started, file is USE_output.txt
taken 4 parameters
commit hash: f92b47f3e71f40446daf297d46fa51563b69c0ac
***START SIMULATION***

[36m
Starting an execution with 10 THREADs, 80 LPs :
	- DYMELOR enabled.
	- CACHELINESIZE 64
	- CHECKPOINT PERIOD 10
	- EVTS/LP BEFORE CLEAN CKP 1000
	- ON_GVT PERIOD 4294967295
	- REPORT prints enabled.
	- THR_POOL_SIZE 256
	- PREEMPT_COUNTER enabled.
	- LONG_JMP enabled.
	- HANDLE_INTERRUPT enabled.

[0mThread 1 set to CPU no 1
Thread 2 set to CPU no 2
Thread 3 set to CPU no 3
Thread 4 set to CPU no 4
Thread 5 set to CPU no 5
Thread 6 set to CPU no 6
Thread 7 set to CPU no 7
Thread 8 set to CPU no 8
Thread 9 set to CPU no 9
Thread 0 set to CPU no 0
LP_metada init finished
Dymelor_init finished
Statistics_init finished
Queue_init finished
master seed is 3247095341077619041
Numerical_init finished
Nodes_init finished
EXECUTED ALL INIT EVENTS
CALLING SLEEPING THREAD
The process will last 300 seconds
[32m[8] Execution ended correctly
[0m[32m[3] Execution ended correctly
[0m[32m[4] Execution ended correctly
[0m[32m[1] Execution ended correctly
[0m[32m[7] Execution ended correctly
[0m[32m[0] Execution ended correctly
[0m[32m[6] Execution ended correctly
[0m[32m[2] Execution ended correctly
[0m[32m[9] Execution ended correctly
[0m[32m[5] Execution ended correctly
[0mSimulation final report:
Thread: 10	LP: 80

===== SYSTEM-WIDE STATISTICS =====
[36mTotal events....................................:     59464583
Committed events................................:     58796804 (98.88%)
Events executed and committed tot...............:      7626432
Straggler events................................:        63691 (0.11%)
Anti events.....................................:        41681 (0.07%)
Useless events..................................:       179087 (0.30%)
Silent events...................................:       488654 (0.82%)
Silent events for GVT...........................:            0 (0.00%)

Flushed events..................................:     59087883 (99.37%)
Fetched operations..............................:     59017643 (99.25%)
   Fetch succeed................................:     59017643 (100.00%)
   Fetch failed.................................:            0 (0.00%)
   Avg node traversed during fetch..............:        57.04

Average time to process any event...............:      4744.34 clocks
   Average time spent in standard execution.....:      4776.97 clocks
   Average time spent in silent execution.......:       806.12 clocks (0.00%)
Average time spent to fetch.....................:     23139.47 clocks (0.00%)
   Average time in successfull fetch............:     23139.47 clocks (0.00%)
   Average time in unsuccessfull fetch..........:         -nan clocks (0.00%)
Average time spent to Enqueue...................:      2059.53 clocks (0.00%)

Save Checkpoint operations.........................................:      5900596
Restore Checkpoint operations......................................:       105372
Rollback operations to resume LP state.............................:            0 (0.00%)
Rollback ops to resume LP state and re-execute evt interrupted.....:            0 (0.00%)
Rollback ops to resume LP state and execute evt in future..........:            0 (0.00%)
Rollback operations................................................:       105372
AVG Rollbacked Events per Rollback.................................:         1.70
AVG Reprocessed Events per Rollback................................:         4.64
CheckOnGVT invocations.............................................:            0

Save Checkpoint time............................:    745336.62 clocks (63.49%)
Restore Checkpoint time.........................:   1158761.09 clocks (98.71%)
Rollback time...................................:   1173857.85 clocks
Checkpoint mem..................................:       988168 B
Checkpoint recalculations.......................:            0
Checkpoint period...............................:            0

Event not flushed tot...........................:            0
Exposition forward Time tot.....................: 441615089130 clocks
Exposition forward Time per event...............:      7488.06 clocks
Exposition silent Time tot......................:    997582156 clocks
Exposition silent Time per event................:      2041.49 clocks

Total resumable rollback executed...............:            0
Avg events resume per rollback_resume...........:         -nan
Avg clock resume per rollback resume............:         -nan clocks

Total allocated space...........................: 54540 MB


Total Clock.....................................: 6584527759202 clocks
Event Processing................................: 282120002656 clocks (4.28%)
Safe Processing.................................: 281726087754 clocks (4.28%)
Frame Processing................................: 280870977158 clocks (4.27%)
Rollback Processing.............................: 123691749404 clocks (1.88%)
Checkpoint Saving...............................: 4397930294972 clocks (66.79%)
Fetch Successful................................: 1365637150794 clocks (20.74%)
[0m
Simulation ended (seconds):       300.12
Simulation ended  (clocks): 658703460052
Last gvt: 16382371.637431
EventsPerSec:    195913.59
EventsPerThreadPerSec:     19591.36
[32mExecution ended correctly
[0mScript done, file is USE_output.txt
parsing statistics...
Done.
Exporting simulation statistics to simulation_stats.json...
Done.
Merging jsons in lp_data...
Done, results are in simulation_results.json.
Done.
FINISHED CPU 2998.14 MEM 0 MAXMEM 56704236 STALE 0 MAXMEM_RSS 55858584
<time name="ALL">2997740</time>

Script done on 2020-12-26 14:57:23+01:00 [COMMAND_EXIT_CODE="0"]
Test 80-400 COMPLETE at 26/12/2020 - 14:57:23
