BEGIN test 159 of 168 with topology 80-400:.............04/01/2021 - 16:50:15
test command:	bash /home/mms/rootsim-models/start.sh -q -g -s --cat=/home/mms/test/catalog --top=/home/mms/test/topologies/80-400.txt use parallel --wt=20 --sched=FIFO --preempt --simulation-timeout=100000 --timeout=75 --lp-aggregation=lan --threads-less-than-lps --redir-compilation-messages=/dev/null --out=/home/mms/test/performance_tests/80-400/target_generation_simulation-seed_-1-timeout_100000-use-parallel-threads_20-FIFO-preempt_yes-sim_proc_no-lp_aggr_lan
results path: /home/mms/test/performance_tests/80-400/target_generation_simulation-seed_-1-timeout_100000-use-parallel-threads_20-FIFO-preempt_yes-sim_proc_no-lp_aggr_lan
Script started on 2021-01-04 16:50:15+01:00 [TERM="screen.xterm-256color" TTY="/dev/pts/4" COLUMNS="190" LINES="51"]
/home/mms/rootsim-models/start.sh: line 2: .venv/edgecomputing/bin/activate: No such file or directory
Starting generator...
Done.
Setting up folders for binary files...
Done.
Creating binary files...
Start first recursion
done layer LAN
Done layer Local
Done layer Wan Local-reg
Done layer REGIONAL
Done layer WAN-Reg-Centr
Done layer CENT
start actuator paths 
done act paths
done LP.txt
start lp top
Done.
Starting simulation...
Using USE as the simulation platform.
Removing previous output files..
Done.
Compiling model...
Done, executable is called "simulation_use" and can be found in the "/home/mms/test/performance_tests/80-400/target_generation_simulation-seed_-1-timeout_100000-use-parallel-threads_20-FIFO-preempt_yes-sim_proc_no-lp_aggr_lan" folder.
Executing model...
Parallel execution with 20 threads.
Script started, file is USE_output.txt
taken 4 parameters
commit hash: 91b3826ceecaae93662d4930724a9e3779e0e537
***START SIMULATION***

[36m
Starting an execution with 20 THREADs, 881 LPs :
	- DYMELOR enabled.
	- CACHELINESIZE 64
	- CHECKPOINT PERIOD 10
	- EVTS/LP BEFORE CLEAN CKP 1000
	- ON_GVT PERIOD 4294967295
	- REPORT prints enabled.
	- THR_POOL_SIZE 1024
	- PREEMPT_COUNTER enabled.
	- LONG_JMP enabled.
	- HANDLE_INTERRUPT enabled.

[0mThread 1 set to CPU no 1
Thread 2 set to CPU no 2
Thread 3 set to CPU no 3
Thread 4 set to CPU no 4
Thread 5 set to CPU no 5
Thread 6 set to CPU no 6
Thread 7 set to CPU no 7
Thread 8 set to CPU no 8
Thread 9 set to CPU no 9
Thread 10 set to CPU no 10
Thread 11 set to CPU no 11
Thread 12 set to CPU no 12
Thread 13 set to CPU no 13
Thread 14 set to CPU no 14
Thread 15 set to CPU no 15
Thread 16 set to CPU no 16
Thread 17 set to CPU no 17
Thread 18 set to CPU no 18
Thread 19 set to CPU no 19
Thread 0 set to CPU no 0
LP_metada init finished
Dymelor_init finished
Statistics_init finished
Queue_init finished
master seed is 3247095340903012213
Numerical_init finished
Nodes_init finished
EXECUTED ALL INIT EVENTS
CALLING SLEEPING THREAD
The process will last 75 seconds
[32m[4] Execution ended correctly
[0m[32m[3] Execution ended correctly
[0m[32m[5] Execution ended correctly
[0m[32m[8] Execution ended correctly
[0m[32m[2] Execution ended correctly
[0m[32m[12] Execution ended correctly
[0m[32m[14] Execution ended correctly
[0m[32m[9] Execution ended correctly
[0m[32m[19] Execution ended correctly
[0m[32m[10] Execution ended correctly
[0m[32m[11] Execution ended correctly
[0m[32m[15] Execution ended correctly
[0m[32m[6] Execution ended correctly
[0m[32m[18] Execution ended correctly
[0m[32m[16] Execution ended correctly
[0m[32m[7] Execution ended correctly
[0m[32m[1] Execution ended correctly
[0m[32m[0] Execution ended correctly
[0m[32m[17] Execution ended correctly
[0m[32m[13] Execution ended correctly
[0mSimulation final report:
Thread: 20	LP: 881

===== SYSTEM-WIDE STATISTICS =====
[36mTotal events....................................:     25737696
Committed events................................:     15865047 (61.64%)
Events executed and committed tot...............:      1681116
Straggler events................................:       402523 (1.56%)
Anti events.....................................:      1238755 (4.81%)
Useless events..................................:      2488302 (9.67%)
Silent events...................................:      7383335 (28.69%)
Silent events for GVT...........................:            0 (0.00%)

Flushed events..................................:     19248314 (74.79%)
Fetched operations..............................:     19593364 (76.13%)
   Fetch succeed................................:     19593118 (100.00%)
   Fetch failed.................................:          246 (0.00%)
   Avg node traversed during fetch..............:       410.56

Average time to process any event...............:      3324.18 clocks
   Average time spent in standard execution.....:      4618.39 clocks
   Average time spent in silent execution.......:       106.87 clocks (0.00%)
Average time spent to fetch.....................:    124500.61 clocks (0.00%)
   Average time in successfull fetch............:    124033.54 clocks (0.00%)
   Average time in unsuccessfull fetch..........:  37324904.11 clocks (0.00%)
Average time spent to Enqueue...................:      9678.66 clocks (0.00%)

Save Checkpoint operations.........................................:      1835258
Restore Checkpoint operations......................................:      1641278
Rollback operations to resume LP state.............................:            0 (0.00%)
Rollback ops to resume LP state and re-execute evt interrupted.....:            0 (0.00%)
Rollback ops to resume LP state and execute evt in future..........:            0 (0.00%)
Rollback operations................................................:      1641278
AVG Rollbacked Events per Rollback.................................:         1.52
AVG Reprocessed Events per Rollback................................:         4.50
CheckOnGVT invocations.............................................:            0

Save Checkpoint time............................:    167257.79 clocks (134.39%)
Restore Checkpoint time.........................:    116434.45 clocks (93.55%)
Rollback time...................................:    124458.21 clocks
Checkpoint mem..................................:       118848 B
Checkpoint recalculations.......................:            0
Checkpoint period...............................:            0

Event not flushed tot...........................:            0
Exposition forward Time tot.....................: 282903733342 clocks
Exposition forward Time per event...............:     15413.43 clocks
Exposition silent Time tot......................:   8058945120 clocks
Exposition silent Time per event................:      1091.50 clocks

Total resumable rollback executed...............:            0
Avg events resume per rollback_resume...........:         -nan
Avg clock resume per rollback resume............:         -nan clocks

Total allocated space...........................: 49232 MB


Total Clock.....................................: 3292279938232 clocks
Event Processing................................:  85556658180 clocks (2.60%)
Safe Processing.................................:  84767579702 clocks (2.57%)
Frame Processing................................:  73279701814 clocks (2.23%)
Rollback Processing.............................: 204270514674 clocks (6.20%)
Checkpoint Saving...............................: 306961199372 clocks (9.32%)
Fetch Successful................................: 2430203767960 clocks (73.82%)
[0m
Simulation ended (seconds):        76.12
Simulation ended  (clocks): 167074487354
Last gvt: 803396.100000
EventsPerSec:    208416.06
EventsPerThreadPerSec:     10420.80
[32mExecution ended correctly
[0mScript done, file is USE_output.txt
parsing statistics...
Done.
Exporting simulation statistics to simulation_stats.json...
Done.
Merging jsons in lp_data...
Done, results are in simulation_results.json.
Done.
FINISHED CPU 1496.06 MEM 0 MAXMEM 51288916 STALE 0 MAXMEM_RSS 50419328
<time name="ALL">1491390</time>

Script done on 2021-01-04 16:51:38+01:00 [COMMAND_EXIT_CODE="0"]
Test 80-400 COMPLETE at 04/01/2021 - 16:51:38
