BEGIN test 93 of 168 with topology 80-400:.............04/01/2021 - 15:31:24
test command:	bash /home/mms/rootsim-models/start.sh -q -g -s --cat=/home/mms/test/catalog --top=/home/mms/test/topologies/80-400.txt use parallel --wt=5 --sched=FIFO --simulation-timeout=100000 --timeout=75 --lp-aggregation=regional --threads-less-than-lps --redir-compilation-messages=/dev/null --out=/home/mms/test/performance_tests/80-400/target_generation_simulation-seed_-1-timeout_100000-use-parallel-threads_5-FIFO-preempt_no-sim_proc_no-lp_aggr_regional
results path: /home/mms/test/performance_tests/80-400/target_generation_simulation-seed_-1-timeout_100000-use-parallel-threads_5-FIFO-preempt_no-sim_proc_no-lp_aggr_regional
Script started on 2021-01-04 15:31:24+01:00 [TERM="screen.xterm-256color" TTY="/dev/pts/4" COLUMNS="190" LINES="51"]
/home/mms/rootsim-models/start.sh: line 2: .venv/edgecomputing/bin/activate: No such file or directory
Starting generator...
Done.
Setting up folders for binary files...
Done.
Creating binary files...
Start first recursion
done layer LAN
Done layer Local
Done layer Wan Local-reg
Done layer REGIONAL
Done layer WAN-Reg-Centr
Done layer CENT
start actuator paths 
done act paths
creating LP.txt
done LP.txt
start lp top
Done.
Starting simulation...
Using USE as the simulation platform.
Removing previous output files..
Done.
Compiling model...
Done, executable is called "simulation_use" and can be found in the "/home/mms/test/performance_tests/80-400/target_generation_simulation-seed_-1-timeout_100000-use-parallel-threads_5-FIFO-preempt_no-sim_proc_no-lp_aggr_regional" folder.
Executing model...
Parallel execution with 5 threads.
Script started, file is USE_output.txt
taken 4 parameters
commit hash: 91b3826ceecaae93662d4930724a9e3779e0e537
***START SIMULATION***

[36m
Starting an execution with 5 THREADs, 80 LPs :
	- DYMELOR enabled.
	- CACHELINESIZE 64
	- CHECKPOINT PERIOD 10
	- EVTS/LP BEFORE CLEAN CKP 1000
	- ON_GVT PERIOD 4294967295
	- REPORT prints enabled.
	- THR_POOL_SIZE 1024
	- PREEMPT_COUNTER enabled.
	- LONG_JMP enabled.
	- HANDLE_INTERRUPT enabled.

[0mThread 1 set to CPU no 1
Thread 2 set to CPU no 2
Thread 3 set to CPU no 3
Thread 0 set to CPU no 0
Thread 4 set to CPU no 4
LP_metada init finished
Dymelor_init finished
Statistics_init finished
Queue_init finished
master seed is 3247095340903012213
Numerical_init finished
Nodes_init finished
EXECUTED ALL INIT EVENTS
CALLING SLEEPING THREAD
The process will last 75 seconds
[32m[2] Execution ended correctly
[0m[32m[3] Execution ended correctly
[0m[32m[0] Execution ended correctly
[0m[32m[1] Execution ended correctly
[0m[32m[4] Execution ended correctly
[0mSimulation final report:
Thread: 5	LP: 80

===== SYSTEM-WIDE STATISTICS =====
[36mTotal events....................................:      9776323
Committed events................................:      9687241 (99.09%)
Events executed and committed tot...............:      1899353
Straggler events................................:        10519 (0.11%)
Anti events.....................................:         2954 (0.03%)
Useless events..................................:        25553 (0.26%)
Silent events...................................:        63495 (0.65%)
Silent events for GVT...........................:            0 (0.00%)

Flushed events..................................:      9751045 (99.74%)
Fetched operations..............................:      9715782 (99.38%)
   Fetch succeed................................:      9715782 (100.00%)
   Fetch failed.................................:            0 (0.00%)
   Avg node traversed during fetch..............:        25.09

Average time to process any event...............:      3366.69 clocks
   Average time spent in standard execution.....:      3385.47 clocks
   Average time spent in silent execution.......:       494.70 clocks (0.00%)
Average time spent to fetch.....................:      9180.69 clocks (0.00%)
   Average time in successfull fetch............:      9180.69 clocks (0.00%)
   Average time in unsuccessfull fetch..........:         -nan clocks (0.00%)
Average time spent to Enqueue...................:      1391.45 clocks (0.00%)

Save Checkpoint operations.........................................:       971799
Restore Checkpoint operations......................................:        13473
Rollback operations to resume LP state.............................:            0 (0.00%)
Rollback ops to resume LP state and re-execute evt interrupted.....:            0 (0.00%)
Rollback ops to resume LP state and execute evt in future..........:            0 (0.00%)
Rollback operations................................................:        13473
AVG Rollbacked Events per Rollback.................................:         1.90
AVG Reprocessed Events per Rollback................................:         4.71
CheckOnGVT invocations.............................................:            0

Save Checkpoint time............................:    654707.21 clocks (91.48%)
Restore Checkpoint time.........................:    705943.34 clocks (98.64%)
Rollback time...................................:    715687.78 clocks
Checkpoint mem..................................:       988093 B
Checkpoint recalculations.......................:            0
Checkpoint period...............................:            0

Event not flushed tot...........................:            0
Exposition forward Time tot.....................:  50651201196 clocks
Exposition forward Time per event...............:      5214.88 clocks
Exposition silent Time tot......................:     80690388 clocks
Exposition silent Time per event................:      1270.81 clocks

Total resumable rollback executed...............:            0
Avg events resume per rollback_resume...........:         -nan
Avg clock resume per rollback resume............:         -nan clocks

Total allocated space...........................: 36716 MB


Total Clock.....................................: 823091651848 clocks
Event Processing................................:  32913884794 clocks (4.00%)
Safe Processing.................................:  32882473962 clocks (3.99%)
Frame Processing................................:  32796235921 clocks (3.98%)
Rollback Processing.............................:   9642461422 clocks (1.17%)
Checkpoint Saving...............................: 636243808802 clocks (77.30%)
Fetch Successful................................:  89197579292 clocks (10.84%)
[0m
Simulation ended (seconds):        75.05
Simulation ended  (clocks): 164717701588
Last gvt: 2613798.525535
EventsPerSec:    129082.32
EventsPerThreadPerSec:     25816.46
[32mExecution ended correctly
[0mScript done, file is USE_output.txt
parsing statistics...
Done.
Exporting simulation statistics to simulation_stats.json...
Done.
Merging jsons in lp_data...
Done, results are in simulation_results.json.
Done.
FINISHED CPU 382.24 MEM 0 MAXMEM 38091668 STALE 0 MAXMEM_RSS 37607292
<time name="ALL">377820</time>

Script done on 2021-01-04 15:32:45+01:00 [COMMAND_EXIT_CODE="0"]
Test 80-400 COMPLETE at 04/01/2021 - 15:32:45
